{
  "$schema": "https://json-schema.org/draft/2020-12/schema",
  "$id": "https://schemas.kumwe.org/studio/v1/content-model.schema.json",
  "title": "Studio content model",
  "type": "object",
  "additionalProperties": false,
  "required": [
    "contractVersion",
    "kind",
    "id",
    "version",
    "revision",
    "owner",
    "status",
    "label",
    "fields",
    "relationships"
  ],
  "properties": {
    "contractVersion": { "$ref": "common.schema.json#/$defs/contractVersion" },
    "kind": { "const": "content-model" },
    "id": { "$ref": "common.schema.json#/$defs/stableId" },
    "version": { "$ref": "common.schema.json#/$defs/semanticVersion" },
    "revision": { "$ref": "common.schema.json#/$defs/revision" },
    "owner": { "$ref": "common.schema.json#/$defs/ownerReference" },
    "status": { "enum": ["draft", "published", "retired"] },
    "label": { "$ref": "common.schema.json#/$defs/messageReference" },
    "description": { "$ref": "common.schema.json#/$defs/messageReference" },
    "fields": {
      "type": "array",
      "minItems": 0,
      "maxItems": 1000,
      "items": { "$ref": "#/$defs/field" }
    },
    "relationships": {
      "type": "array",
      "maxItems": 1000,
      "items": { "$ref": "#/$defs/relationship" }
    },
    "extensions": { "$ref": "common.schema.json#/$defs/extensions" }
  },
  "allOf": [
    {
      "if": {
        "properties": { "status": { "const": "published" } },
        "required": ["status"]
      },
      "then": {
        "properties": {
          "fields": { "type": "array", "minItems": 1 }
        }
      }
    }
  ],
  "$defs": {
    "field": {
      "type": "object",
      "additionalProperties": false,
      "required": ["id", "kind", "label", "required", "localized", "cardinality"],
      "properties": {
        "id": { "$ref": "common.schema.json#/$defs/localName" },
        "kind": {
          "oneOf": [
            {
              "enum": [
                "string",
                "rich-text",
                "boolean",
                "integer",
                "decimal",
                "money",
                "date",
                "date-time",
                "enum",
                "media",
                "resource",
                "object",
                "collection"
              ]
            },
            { "$ref": "common.schema.json#/$defs/qualifiedName" }
          ]
        },
        "label": { "$ref": "common.schema.json#/$defs/messageReference" },
        "description": { "$ref": "common.schema.json#/$defs/messageReference" },
        "required": { "type": "boolean" },
        "localized": { "type": "boolean" },
        "cardinality": { "enum": ["one", "many"] },
        "semanticRole": { "$ref": "common.schema.json#/$defs/qualifiedName" },
        "defaultValue": { "$ref": "common.schema.json#/$defs/jsonValue" },
        "authoring": { "$ref": "#/$defs/authoringMetadata" },
        "constraints": {
          "type": "object",
          "additionalProperties": false,
          "properties": {
            "minimum": {
              "type": "string",
              "pattern": "^-?(0|[1-9][0-9]*)(?:\\.[0-9]+)?(?![\\s\\S])",
              "maxLength": 200
            },
            "maximum": {
              "type": "string",
              "pattern": "^-?(0|[1-9][0-9]*)(?:\\.[0-9]+)?(?![\\s\\S])",
              "maxLength": 200
            },
            "scale": { "type": "integer", "minimum": 0, "maximum": 100 },
            "minLength": { "type": "integer", "minimum": 0, "maximum": 10000000 },
            "maxLength": { "type": "integer", "minimum": 0, "maximum": 10000000 },
            "validator": {
              "$ref": "common.schema.json#/$defs/qualifiedName"
            },
            "validatorArguments": {
              "type": "object",
              "maxProperties": 20,
              "propertyNames": {
                "$ref": "common.schema.json#/$defs/safeJsonMemberName"
              },
              "additionalProperties": {
                "$ref": "common.schema.json#/$defs/jsonValue"
              }
            },
            "minItems": { "type": "integer", "minimum": 0, "maximum": 100000 },
            "maxItems": { "type": "integer", "minimum": 0, "maximum": 100000 },
            "allowedMediaKinds": {
              "type": "array",
              "maxItems": 50,
              "uniqueItems": true,
              "items": { "enum": ["image", "video", "audio", "document", "archive", "other"] }
            }
          }
        },
        "enumValues": {
          "type": "array",
          "minItems": 1,
          "maxItems": 1000,
          "items": {
            "type": "object",
            "additionalProperties": false,
            "required": ["value", "label"],
            "properties": {
              "value": { "$ref": "common.schema.json#/$defs/localName" },
              "label": { "$ref": "common.schema.json#/$defs/messageReference" }
            }
          }
        },
        "fields": {
          "type": "array",
          "maxItems": 1000,
          "items": { "$ref": "#/$defs/field" }
        },
        "itemKind": {
          "oneOf": [
            {
              "enum": [
                "string",
                "rich-text",
                "boolean",
                "integer",
                "decimal",
                "money",
                "date",
                "date-time",
                "enum",
                "media",
                "resource",
                "object"
              ]
            },
            { "$ref": "common.schema.json#/$defs/qualifiedName" }
          ]
        },
        "extensions": { "$ref": "common.schema.json#/$defs/extensions" }
      }
    },
    "authoringMetadata": {
      "type": "object",
      "additionalProperties": false,
      "properties": {
        "control": { "$ref": "common.schema.json#/$defs/qualifiedName" },
        "placeholder": { "$ref": "common.schema.json#/$defs/messageReference" },
        "group": { "$ref": "common.schema.json#/$defs/localName" },
        "order": { "type": "integer", "minimum": 0, "maximum": 100000 },
        "readOnly": { "type": "boolean" },
        "hidden": { "type": "boolean" },
        "width": { "enum": ["full", "half", "third", "two-thirds"] }
      }
    },
    "relationship": {
      "type": "object",
      "additionalProperties": false,
      "required": ["id", "kind", "label", "sourceField", "targetModel", "required", "onDelete"],
      "properties": {
        "id": { "$ref": "common.schema.json#/$defs/localName" },
        "kind": { "enum": ["one-to-one", "many-to-one", "one-to-many", "many-to-many"] },
        "label": { "$ref": "common.schema.json#/$defs/messageReference" },
        "sourceField": { "$ref": "common.schema.json#/$defs/localName" },
        "targetModel": { "$ref": "common.schema.json#/$defs/artifactReference" },
        "targetField": { "$ref": "common.schema.json#/$defs/localName" },
        "required": { "type": "boolean" },
        "onDelete": { "enum": ["restrict", "nullify", "detach"] },
        "authoring": {
          "type": "object",
          "additionalProperties": false,
          "required": ["control", "allowCreate"],
          "properties": {
            "control": { "$ref": "common.schema.json#/$defs/qualifiedName" },
            "allowCreate": { "type": "boolean" },
            "displayField": { "$ref": "common.schema.json#/$defs/localName" },
            "searchProvider": { "$ref": "common.schema.json#/$defs/qualifiedName" }
          }
        },
        "extensions": { "$ref": "common.schema.json#/$defs/extensions" }
      }
    }
  }
}
